engagement,procedural,procedural_question,question,weak_question,topic_intro,uids_str,committee_position,committee_position_next,committee_position_prev,pid,pid_next,pid_prev,simple_label,simple_label_next,simple_label_prev,text,text_next,text_prev,uid_next,uid_prev,uids,vid
FALSE,FALSE,FALSE,TRUE,FALSE,FALSE,[470958],Not In Committee,Not In Committee,Not In Committee,5,46,46,Legislator,Bill Author,Bill Author,"Mr. Chair. So that travelers are accustomed to the same hours, would this be the same hours as we have in the northern California?","Yeah it would be the same as northern California. So in northern California, if I remember this correctly.","No thank you, I respectfully ask your aye vote.",470966,470956,[470958],508
FALSE,FALSE,FALSE,TRUE,FALSE,FALSE,[7296868],Member,Not In Committee,Chair,93,16,1,Legislator,Bill Author,Legislator,"And then, and I appreciate the questions here. And the other item is in regards to OES and then I think OES is offering up some amendments as well. And that works for the bill, correct? Can you just go into those?","Right, we are looking at amendments that might align terminology. Nothing to change the policy. So we are, like I said, we're totally working with OES and with the governor's office to make sure that this is good all around. I think we all are settled on the policy.","Any comments, concerns? I'm sorry. Let's go to witnesses. Why are you here? Okay. Any other witnesses in support? Any witnesses in opposition other than Austin? Okay. Any comments, concerns from the members? Mr. McGuire.",7296872,7296848,[7296868],7333
FALSE,FALSE,TRUE,FALSE,FALSE,FALSE,[3791928],Member,Member,Not In Committee,107,96,2998,Legislator,Bill Author,General Public,Senator Pan?,"Thank you, Mr President, members. I'm proud to present SCR 64 which celebrates and honor the 25th anniversary of the American with Disabilities Act. On July 26th, 1990, the Ada was signed into law and became the most comprehensive civil rights bill in history for people with disabilities.","Secretary please read. Senate Concurrent Resolution 64 by Senator Pan, relative to the Americans with Disabilities Act.",3791930,3791926,[3791928],4921
FALSE,FALSE,FALSE,TRUE,FALSE,FALSE,[3573758],Member,Member,Member,54,48,24,Legislator,Bill Author,Legislator,"So what this bill is saying, that if we build additional government buildings, that they would be required also to have these devices?","Under the memorandum, yes. Under the administrative policy, all state buildings that meet this requirement will have AEDs, yes.","Yes, Senator Hueso, will you accept the question? Yeah? Please proceed.",3573760,3573748,[3573758],4593
FALSE,FALSE,FALSE,TRUE,FALSE,FALSE,[18925792],Member,Not In Committee,Chair,100,34362,34364,Legislator,Bill Author,Legislator,"I understand that, Senator, my confusion is that is this only if you are going to and from work and are not on duty? Or is this any-","Correct, yeah.","All right, we have a motion, Senator Jackson.",19065802,18925781,[18925792],32686
FALSE,FALSE,FALSE,TRUE,FALSE,FALSE,[1882766],Member,Not In Committee,Not In Committee,67,103,85,Legislator,Bill Author,Legislator,"Right, so my question is just based on what was in the analysis and having the read the bill about lowering that. Is that, is that all right in terms of the ceiling? In the event that interest rates do increase. That's what I'm asking. Are you open to lowering the ceiling?","There's been no amendments proposed, the Chair hasn't proposed any amendments and at this point I'm not willing or prepared to do that.","Thank you. See no additional in support? Witnesses in opposition? Seeing none. Questions or comments from committee members, Assemblymember Ridley-Thomas.",1882778,1882732,[1882766],1788
FALSE,FALSE,FALSE,TRUE,FALSE,FALSE,[13224971],Member,Member,Chair,4657,107,93,Legislator,Bill Author,Legislator,"Okay, so I prepared tax returns. I'm assuming, I don't know, I haven't asked you, but have you ever prepared tax returns or done any tax work for clients?","No, I'm not an accountant.","Hey, see there we go. You're looking good there.",13224974,13226091,[13224971],27455
FALSE,FALSE,FALSE,TRUE,FALSE,FALSE,[5080805],Member,Member,Chair,105,52,63,Legislator,Bill Author,Legislator,"Thank you, Madam Chair. Senator, is there anything in here that would have any requirement of quality, just a matter of time they spend and they get past some threshold and they're going to get a bonus, or?","Yes, I didn't put it as a, you're right, it's just a straight bonus for teachers who are come into the profession, and teachers who are here that might be thinking about leaving early, we're trying to keep them here.","Senator Huff, you have a question?",5080811,5080803,[5080805],6374
FALSE,FALSE,FALSE,TRUE,FALSE,FALSE,[11260598],Vice-Chair,Not In Committee,Chair,14,53,11,Legislator,Bill Author,Legislator,And the last question I had is we had the testimony in terms of student access to be able to get their ballots. But wouldn't current law between vote centers appearing on college campuses and such allow for much greater access in terms of being able to transmit ballots? As well as current law that allows your local ballot harvester to be able to bring those ballots through that process?,So I am proud to have authored and co-authored the previous legislation that hopefully we will go to the vote centers that of course is up to each individual county under SB 450. As far as being able to collect multiple ballots that will be even highly encouraged because we will be saving the state money if people actually collect them and walk them in rather than send them.,"Thank you very much. Any additional witnesses in support? Okay, seeing none, we have any wishing to speak in opposition? Okay, seeing none. I move the bill. Second.>>He moved and second, any questions from any Committee Members? Mr. Harper?",11260601,11260559,[11260598],24265
FALSE,FALSE,TRUE,FALSE,FALSE,FALSE,[3780914],Member,Member,Not In Committee,24,25,2998,Legislator,Bill Author,General Public,Senator Monning?,"Thank you, Mr. President and members. Amendments taken in the Assembly simply add coauthors. I respectfully ask for your aye vote in the Assembly amendments. Thank you.",Roll.,3780916,3780730,[3780914],4999
FALSE,FALSE,TRUE,FALSE,FALSE,FALSE,"[756607, 756609, 756611, 756613, 756669, 756671, 756673]",Not In Committee,Not In Committee,Not In Committee,3,,67,Legislator,Unlabeled,Legislator,"Okay. And a second?, So, Mr. Gatto moves, Jones seconds., And we'll vote on consent., Where's the item consent?, Nine to zero, and consent., All right, excuse us Mr. Ridley-Thomas., We're back to you and I think we already had a motion from Mr. Wilk.",Second.,"Let's do 808 if possible, Madam Chair.",756675,756589,"[756607, 756609, 756611, 756613, 756669, 756671, 756673]",801
FALSE,FALSE,TRUE,FALSE,FALSE,FALSE,"[756607, 756609, 756611, 756613, 756669, 756671, 756673]",Not In Committee,Not In Committee,Not In Committee,3,,67,Legislator,Unlabeled,Legislator,"Okay. And a second?, So, Mr. Gatto moves, Jones seconds., And we'll vote on consent., Where's the item consent?, Nine to zero, and consent., All right, excuse us Mr. Ridley-Thomas., We're back to you and I think we already had a motion from Mr. Wilk.",Second.,"Let's do 808 if possible, Madam Chair.",756675,756589,"[756607, 756609, 756611, 756613, 756669, 756671, 756673]",801
FALSE,FALSE,FALSE,TRUE,FALSE,FALSE,[12002091],Vice-Chair,Not In Committee,Member,14,108894,100944,Legislator,General Public,Legislator,Thank you very much. If you could help me understand how this affects charter cities and potential charter amendments that are required to be able to modify city charters.,"Yeah, so charter cities would be required to comply with CEQA, they currently are required to comply with CEQA. Charter cities are included in the definition as elite agency under CEQA. So because this bill changes the definition of projects under CEQA, it will affect charter cities as well. But the Legislature is not allowed to tell charter cities what their elections procedures must be.","Great, thank you very much. Any additional witnesses in opposition? Seeing none, I will now turn it back to the Committee. Any questions from Committee Members? Vice Chair Harper.",12002092,12002089,[12002091],26664
FALSE,FALSE,FALSE,TRUE,FALSE,FALSE,"[247124, 247140]",Member,Not In Committee,Chair,83,3576,22,Legislator,State Agency Rep,Legislator,"Thank you for coming to the committee Sorry, I was late in the beginning. I was doing testimony in Higher Ed, for two bills that I had for veterans which community college in both UC and CSU. So, I'm sure you'll be supportive of it as it goes through. Figured I'd make a plug., First of all, I'm interested in the issue of what we're going to be doing in the Bottom-Up Review for the universities. As I heard the testimony a few weeks ago, it seemed like there was a lot of confusion on the terms. President Napolitano, do you feel that we've come to closure that we understand what we're trying to do, that what we're asking you? Because from the hearing I got, I heard we couldn't even figure it out what the definition was, so.","Yeah, we were getting into budget weeds pretty quickly there. I think that, ""Yes"", as I said to Assemblymember Ting, we are working through that and we want to make available in the format that you needed the information that you require for your decision making.",Okay. Thank you. Assemblymember Chavez.,247168,247118,"[247124, 247140]",272
FALSE,FALSE,FALSE,TRUE,FALSE,FALSE,"[14669041, 14674332]",Member,Not In Committee,Chair,70,521,92,Legislator,General Public,Legislator,"Richard?, There's nothing here to prevent a district from doing a non-PLA housing project if they want to. Just make sure I understand because I'm not as familiar with the bill everyone up at dais. Is that correct, though?",Well if they wanted to use the authority granted by Mr Thurmond's bill they would have to adopt the PLA. The PLA would be the mandate under the Thurmond bill.,We just have a question from Senator Allen.,14669043,14669040,"[14669041, 14674332]",30094
FALSE,FALSE,FALSE,TRUE,FALSE,FALSE,"[9688048, 9688051]",Member,Not In Committee,Co-Chair,10,101386,87,Legislator,General Public,Legislator,"Thank you. My final comment and question is being former law enforcement I'm very sensitive to the ongoing national discussion about police and community relations. This past fall I attended four funerals in less than a month for officers killed violently in the line of duty. One funeral was for Lancaster Deputy Sergeant Steve Owen from my district who was killed while responding to a burglary. Another was for a Palm Springs officer who had just returned from maternity leave, Ms. Lesley Zerebny. Nationally, we've seen attacks targeting officers in Dallas and Baton Rouge, and since being elected I've had regular meetings with community members and community leaders, and law enforcement, to discuss how we can build trust back., These meetings provide important perspective and have helped me better understand why some people in the community distrust law enforcement. However, with the number of attacks on officers we have seen, it's clear we need to do everything in our power to reduce tensions and improve trust. Do you see a role for California's Attorney General to improve police-community relations and do you have thoughts about the steps we can take?","Trust comes after there's respect and without the respect, you'll never gain the trust and you won't get the cooperation, if you don't have the trust and so, from my perspective we almost have to start at the A, B, C's here, because communities have become very divided. I believe the law enforcement community has to do more to reach out to communities that have seen victims as a result of ambitious law enforcement activity and I believe communities that have been the victims have to reach out to the law enforcement to try to get a sense of how difficult the job has become with the technology and the capacity of weapons these days and so I think we have to go back to the first step of respect. Before we can get to trust, we'll never get to cooperation if we can't do the first two.","Thank you, Dr. Weber. Thank you. Mr. Lackey?",9688053,9688028,"[9688048, 9688051]",16589
FALSE,FALSE,FALSE,TRUE,FALSE,FALSE,"[13761442, 13813936]",Not In Committee,Not In Committee,Chair,4657,15930,64,Legislator,State Agency Rep,Legislator,"Thank you, Madam Chair. I appreciate, Assemblyman Obernolte, using the terms the purpose for which it is intended for Prop 56. I'm just curious, Ms. Costas, why Prop 56 is so confusing to the Department of Finance?, What is the intent of Prop 56? Not only here, but also with UC residencies. It seems like we're arguing. And there shouldn't be an argument, but the Governor has decided to do something completely different with 56 than what was intended. And how do we solve that, Madam Chair?","Okay. If I may, Madam Chair. I don't want to spoil our fun. We have other agenda items ahead of us on this very issue, Senator. So some in a couple pages, some-",Mr. Moorlach.,13761444,13761440,"[13761442, 13813936]",27987
FALSE,FALSE,FALSE,TRUE,FALSE,FALSE,"[10570355, 10570356]",Member,Not In Committee,Chair,36813,3067,34400,Legislator,General Public,Legislator,"So looking at our future growth and I was looking at the breaking it down by region., What can you tribute the job gain to in the IE?","So, the job gain in the IE is been driven.",Thank you. Great clarification. Assembly Member Cervantes.,10570357,10570354,"[10570355, 10570356]",23788
FALSE,FALSE,FALSE,TRUE,FALSE,FALSE,"[14994396, 14994397, 14994398, 14994399, 14994400, 14994401]",Member,Not In Committee,Chair,31,3177,2,Legislator,State Agency Rep,Legislator,"Just a quick question. Thank you for the thoughtful presentation, I know this is a challenge for all of us. It sounds like there's potentially a number of options to pursue, it'll probably be some kind of a package approach to deal with a structural gap., My question is on, just curious about the source of the funds for the lifetime license trust account. Those lifetimes licenses rage from 700 to 1,200 depending on the age of the buyer. I mean you're trying to incentivize the purchase of those? Yes., Is that a deal for hunters and fishermen? I'm an annual purchase for like a three day thing. I'm not one of these lifetime guys but- Well, can I change your mind?, What's that? You can have that conversation outside. So, have you made adjustments in that 700 to 1,200. What kind of a deal is that for hunters and fisher persons in the State of California?, And then you've got a sliding scale there, right? I'm just curious about the administrative challenges of doing some kind of a sliding scale for landing fee increases based on the year. You were talking about sensitivity around a lousy salmon year and we're hitting them with the same fee regardless., Is there any kind of flexibility contemplated which is a more sensitive one given the nature of the economy and what kind of a fishing year it is? If you could try to blend an answer to those two different questions.",Let me start with your first question.,Mr. Mullen?,14994402,14994395,"[14994396, 14994397, 14994398, 14994399, 14994400, 14994401]",29906
FALSE,FALSE,FALSE,TRUE,FALSE,FALSE,[11260562],Vice-Chair,Not In Committee,Chair,14,8596,11,Legislator,General Public,Legislator,"Thank you. In the analysis or in the background, there was no submission of any studies in terms of affecting voter turnout. Could you tell me, what's that occasion that you site? Because it makes it challenging to be able to confirm whether it really does affect voter turn out when it isn't included into the background.","Yes absolutely, Assemblyman Harper. It is actually a very recent article that came out in the election line newsletter on March 2nd. It's footnoted in my official letter of support on the bill to the Committee. And the article is called Stamp of Approval and you can find through the election line website. I'd be happy to email a link for it too, if you'd like.","Thank you very much. Any additional witnesses in support? Okay, seeing none, we have any wishing to speak in opposition? Okay, seeing none. I move the bill. Second.>>He moved and second, any questions from any Committee Members? Mr. Harper?",11260566,11260559,[11260562],24265
FALSE,FALSE,FALSE,TRUE,FALSE,FALSE,[7543996],Member,Not In Committee,Chair,113,700,114,Legislator,General Public,Legislator,"Yes, just couple questions for just a couple of the panelists with regard the plan implementation and the design of the plan and some of the outreach. Maybe this question is for Mr. McGavin, if you will. Has there been outreach to your organization as to what maybe this plan could look like in getting some feedback for your organization?","Yes, there has. We've had opportunities, both in the public processes like the Freight Advisory Committee, the agencies had multiple workshops around the state. This winter, ARB and CTC have both had this on their public agendas, and we've also had an opportunity to meet with staff from the agencies.","Mr. O'Donnell, I believe you had a question or comment?",7544000,7551908,[7543996],7434
FALSE,FALSE,TRUE,FALSE,FALSE,FALSE,"[13680754, 13680755, 13680756, 13680762, 13680763, 13680764]",Member,Not In Committee,Member,7492,14856,47,Legislator,General Public,Legislator,"Seeing no further discussion or debate. Dr. Wood would you like to close? Respectfully ask for your aye vote., The clerk will open the roll., All those vote who desire to vote., Dr. Wood requests we move the call., Pass and retain on file item 246., File item 247, AB 391 the clerk will read.","Assembly bill 391, by Assemblymember David Chiu and others an act relating the Medi-Cal.","Look, the price of drugs has driven up the tax base because we pay Medi-Cal, Medicaid rates and that's what drives up the cost. I think this is a good bipartisan port so I request that if you amend the bill that I be added as a co-author if you may at some time I support this bill. I think it's good policy. I recommend an aye vote.",13680765,13680753,"[13680754, 13680755, 13680756, 13680762, 13680763, 13680764]",27926
FALSE,FALSE,FALSE,TRUE,FALSE,FALSE,"[1268890, 1268902, 1268914]",Member,Not In Committee,Member,26,9904,64,Legislator,State Agency Rep,Legislator,"I think that's great. I love that kind of streamlining. And then, I just wanted to commend you also, you mentioned the distribution of the monies, and it sounds like small counties and large counties alike have been receiving funding and just one final question and I'll let you continue., For the crisis residential treatment beds versus the crisis stabilization, you've talked about the new idea of there may be more of a need for crisis stabilization money than crisis residential. Are you saying that the demand for crisis stabilization has far exceeded that for crisis residential?, And that's why you're considering making this recommendation that based on the, I don't want to call it the marketplace, but we seem to be hopefully satisfying the crisis treatment beds, but it's the stabilization ones that need the higher priority at this time based on where we are in the program?","Not speaking from any place of authority on this. There are members in your audience that can comment more succinctly and precisely about the need, but from our perspective, we had more applications to draw down that smaller amount, the $15 million that was available for crisis stabilization.","Sure, please proceed.",1268926,1268852,"[1268890, 1268902, 1268914]",1231
FALSE,FALSE,FALSE,TRUE,FALSE,FALSE,[1246783],Possible Chair,Not In Committee,Member,66,3533,74,Legislator,General Public,Legislator,"Thank you, Ms. Baker. Ms. Howle, the issue of transitioning from DGS to Cal Tech, were the same, was the same authority with DGS as today with Cal Tech, in terms of monitoring, oversight, appeal, and actually terminating contracts?","So, if I understand your question, Senator, does Cal Tech have the same authority that DGS had",Thank you.,1246799,1246781,[1246783],1211
FALSE,FALSE,FALSE,TRUE,FALSE,FALSE,"[588812, 588814]",Not In Committee,Not In Committee,Not In Committee,67,8473,8473,Legislator,General Public,General Public,"All right, thank you all for your presentation., Couple of quick points, LEP voters, you said eligible 2.6 million, how many registered?",I'm not sure about the exact number of registered--,"And I'd be happy to take any questions, thank you.",588816,588810,"[588812, 588814]",626
FALSE,FALSE,FALSE,TRUE,FALSE,FALSE,"[4735474, 4735478, 4735482, 4735484, 4735486]",Vice-Chair,Not In Committee,Member,26,522,100,Legislator,Lobbyist,Legislator,"Thank you so, I have some questions of my own. At the local level, I served down on board supervisor, I served on City Council. We had a project come through, you got well served letter from a local water agency. You have enough water, you give them a permit, they get the bill. So now, just identify what you have to do now., Now you have to do a study, basically a CEQA amendment study. That obviously the more CEQA work you do, the more vulnerable I think you are to litigation. You talked about another eight years potentially. I associate a lot of my comments with Senator Hueso's. We're trying to get affordable housing built in my district., But we have a lot of the same problems that Imperial County has, and I see this as a way to give opposition to building more ammo. And at a time when we really need the construction jobs and we need housing for certainly many areas that I represent. Where more than 40% of certain populations rent, and they would like to own., The problem is that there is not a whole lot of development going on right now. And I don't see this as a way of priming the pump, if you will, to get more development going without making it more expensive. For developers, which we are going to pass the cost on to the home builder., If it's an affordable home builder, it's going to be more difficult to make it affordable. So, I'd like you to respond to some of these issues. And are there any other laws that connect land use approvals with water supply in the State of California at this time?","Well, yes, there are many other laws, I had mentioned a few of them. There's a provision in Mr. Herzberg's bill from the same year, 2001, or is it 2000? 2000, and actually we had worked together on putting that provision in on making sure that there was water available in a timely manner for those projects.","So, this is a problem that isn't tomorrow we can't sluff it off for a year because we got a lot of water, we're in a very serious situation. I want to commend the [UNKNOWN] Center for bringing up what is a very difficult issue but we have got to find some ways to resolve this sooner rather than later.",4735490,4735470,"[4735474, 4735478, 4735482, 4735484, 4735486]",6067
FALSE,FALSE,FALSE,TRUE,FALSE,FALSE,"[7718989, 7718991, 7718993]",Vice-Chair,Not In Committee,Chair,68,16509,60,Legislator,State Agency Rep,Legislator,"This, historically though, these positions have not been looked at as a job, full time job. It has been looked at as service. And now we are elevating it and sanctifying it as a job, and this is a comment that the public, who I hope some of are watching., You are now inviting a whole new level of government be more formalized in a paid level of government. What does it mean in the Timber Regulation Forest Restoration fund per diem a quote reasonable per diem to non-government members For attendance of a meeting of a related Advisor Committee., Who determines what a reasonable per diem is? Who makes that determination? Does the Legislature make that determination?",We have assumptions about how much we have appropriated for that reasonable per diem.,"Okay. Senator Nielsen, Senator Moorlach.",7718995,7718965,"[7718989, 7718991, 7718993]",7535
FALSE,FALSE,FALSE,TRUE,FALSE,FALSE,[13100625],Member,Not In Committee,Not In Committee,4657,111162,111162,Legislator,State Agency Rep,State Agency Rep,"Yeah, that's off-site, having to go somewhere? I'm just wondering, can I help him to get to know the delegation or the Legislature a little better?","I'm sure he'd love it, and I will convey that message. Thank you, yeah, absolutely.","And number one on that list was one of our campuses, Cal State, LA, with many CSUs there. There's just a heck of a lot to be proud of. I'll close by saying the benefit is not just for the state, it's for the students, it's for their families, and it's for their communities. Thank you very much.",12895483,12895470,[13100625],27215
FALSE,FALSE,FALSE,TRUE,FALSE,FALSE,[1124030],Member,Not In Committee,Not In Committee,94,3172,3172,Legislator,State Agency Rep,State Agency Rep,"So, the language in those bills is something that the Board of Water's comfortable with?",Yes.,"But if the legislature is interested in providing Water Boards with explicit role in the injection well permits and aquifer exemptions, we would suggest that the approach described in pending legislation AB 356 and SB 454, which requires Water Board concurrence prior to DOGGR's submittal of a proposal for aqua exemption to USCPA, would be an appropriate path forward.",1124032,1124022,[1124030],1090
FALSE,FALSE,FALSE,TRUE,FALSE,FALSE,[241624],Member,Not In Committee,Chair,44,1399,81,Legislator,General Public,Legislator,"Okay, Are you representing the university administration I should ask? I mean are you representing the UC president and the folks who basically make money decisions?","I am, yes I represent the University of California Office of the President on health issues. So yeah, it's my understanding, I mean I don't have any other understanding that if the money is given for this specific purpose that it wouldn't be used for other than for this specific purpose.",Ms. Weber?,241632,241618,[241624],265
