engagement,procedural,procedural_question,question,weak_question,topic_intro,uids_str,committee_position,committee_position_next,committee_position_prev,pid,pid_next,pid_prev,simple_label,simple_label_next,simple_label_prev,text,text_next,text_prev,uid_next,uid_prev,uids,vid
TRUE,FALSE,FALSE,FALSE,TRUE,FALSE,[6884583],Not In Committee,Not In Committee,Not In Committee,53,3284,15930,Legislator,State Agency Rep,State Agency Rep,"I would just wonder if as we're doing that we might provide in case in the future we want to add something else. Provide for the software in a way you could add additional. Wouldn't it make more sense to preplan for that, rather than. This is the most discussion I ever had on it, so I'm using everything you'll give me.","Miss you're right. It seems reasonable to the extent that like most IT products, from my understanding if you give it the capacity, you can add on stuff on top of it. And it does seem reasonable, but like I said, I'm not working on the project, so I can't really provide you too much detail and specifics on it. And we're still in planning phase at the moment, too.","And I think that there is concern about the ability to implement it in budget year given the lack of infrastructure. So it's likely a more long term question, budget year plus one or beyond. Because the department really, there's a lot of moving pieces here with the move towards EBT with other benefits, where this may be more appropriate than in the current infrastructure or lack thereof we have for this type of a voucher program.",6884585,6884545,[6884583],7175
FALSE,TRUE,FALSE,FALSE,FALSE,FALSE,[5127808],Member,Not In Committee,Not In Committee,64,5865,7269,Legislator,General Public,General Public,"Thank you very much, next witness please, one minute.","Jennifer Greppi, Parent Voices California. And I just wanted to talk quickly about SMI and the fact that, yes, it's 2007. But it's based on 2005 numbers. And what that means is that parents, family, a single mom with two children could earn 22% more. That's 900 extra dollars that that parent could earn if the levels were bought to current. This is a huge issue and it has to be addressed this year in the budget. Thank you.","Now, any investment you make in increasing rates for CSBP, for example, then would be on the Proposition 98 side of the ledger. However, any changes to the rates that impact CSBP also impact the rates of their brethren who are funded through non-98. So, you are weighing those issues as you look at it rate increases and your funds.",5127810,5127742,[5127808],6399
FALSE,FALSE,TRUE,FALSE,FALSE,FALSE,[7652069],Vice-Chair,Not In Committee,Not In Committee,26,19460,19460,Legislator,General Public,General Public,Mr. Reid?,"Yeah, Mr. Chairman and members, Aaron Reid. I'll be very brief. This bill is actually long overdue. Our firefighters fight right alongside local firefighters and they have a completely different and a better benefit. Not only that, they get paid 30% more money, and they also work a shorter work week. 56 hours versus my CAL FIRE 72 hour work week. But this is not about the pay or the work week.","Thank you, Madam Speaker.",7652071,7690526,[7652069],7493
FALSE,TRUE,FALSE,FALSE,FALSE,FALSE,[1078125],Possible Chair,Not In Committee,Member,100,8580,70,Legislator,State Agency Rep,Legislator,Thank you.,"The, the May Revise of the governor's budget released just a few hours ago at this point provides $265 million of funding for the transit intercity rail capital program. And allows us to increase funding in the, in our current call for projects from the 125 million to 290 million when combined with last year's appropriation.","And I just want to see what we can do to to join the league of civilized nations with regards to a decent passenger rail network. Thank you very much, and I would like to add that I just came back from a trip to Japan where we rode their high speed rail, their regular rail.",1078127,1077831,[1078125],1055
FALSE,TRUE,FALSE,FALSE,FALSE,FALSE,"[2692544, 2695252]",Member,Not In Committee,Member,31,14856,108,Legislator,General Public,Legislator,"Ayes 74, Noes 0., Ayes 74, Noes 0.",Senate concur with resolution 44.,"On my own time, you are just truly amazing. The gentleman from Irvine.",2695253,2692458,"[2692544, 2695252]",4223
FALSE,TRUE,FALSE,FALSE,FALSE,FALSE,"[6343770, 6343778]",Member,Not In Committee,Member,31,14856,31,Legislator,General Public,Legislator,"Thank you, Doctor Quirk. Seeing no discussion or debate on these amendments and without objection, we may take a voice vote. All those in favor, say aye. Aye. Opposed, say nay. The ayes have it. The amendments are adopted. Bill is out to print and back on file., Members, we're dispensing with amendments. We're going to move to File Item number 83. File Item number 83, that's AB 2220, by Mister Cooper.","Assembly Bill 2220, with amendments, by Assemblymember Cooper.","Thank you, Mr. Stone. Back on the file. File items. 43 through 40, pardon me, 43 through 55, pass and retain. We've dispensed with File Item 56. Members we're going to move to File Item number 79. That's AB 2590, for the purpose of amendments.",6343784,6343686,"[6343770, 6343778]",7018
FALSE,TRUE,FALSE,FALSE,FALSE,FALSE,[803256],Member,Not In Committee,Member,4657,3465,59,Legislator,LAO,Legislator,Coming after you then.,"And, and since you're interested in these sorts of things Senator Moorlach, that because that is a pretty large chunk of money that is going through the community colleges but not only for community colleges. It will go to adult schools, which are part of the the school district system. As well as community colleges. That is excluded from this calculation of this share of Prop 98 that goes to community colleges versus school districts.","So, so I would again ask that for the post May revise meeting we look at utilizing some funding for this. And with that I will ask colleagues if there are any other questions, comments. Senator Moorlach?",803258,803214,[803256],838
TRUE,FALSE,FALSE,FALSE,FALSE,FALSE,[2130932],Member,Not In Committee,Not In Committee,64,3152,4089,Legislator,State Agency Rep,General Public,And primarily because of the federal requirement; that's a big difference because its glued to the federal dolars.,"In IHSS the federal funding is driven by the federal Medicaid requirement to be, you are a Medicaid provider as a IHSS provider.","Know this please - we are no longer asking to be heard, respected, and treated fairly. We're here to tell this Legislature and the Governor it's no longer about making the right choice it's time to just do the right thing. Thank you very much.",2044743,2044549,[2130932],1925
FALSE,TRUE,FALSE,FALSE,FALSE,FALSE,"[4504430, 4504434]",Member,Not In Committee,Member,64,16596,64,Legislator,General Public,Legislator,"And we'd simply like, as I said earlier, for the Legislature to provide greater oversight over the agency and ensure it's performing its mission. Thank you., Next witness.","Hello, my name's Dr. Melinda Ginn. And I'm here also with Fred Seavey. And I was a provider at Kaiser for over 20 years, and was one of the people that worked intensively actually with the DMHC to try to bring about reforms in the service that we were able to provide to our patients.",We begin our third hearing of Budget Subcommittee 3.,4504436,4504372,"[4504430, 4504434]",5746
FALSE,TRUE,FALSE,FALSE,FALSE,FALSE,[755745],Not In Committee,Not In Committee,Not In Committee,3,2294,87,Legislator,General Public,Legislator,Thank you.,In opposition.,"Now my joint author, Assemblymember Bonta, will discuss the specifics of the regulatory structure in AB 34.",755747,755387,[755745],800
FALSE,TRUE,FALSE,FALSE,FALSE,FALSE,[755745],Not In Committee,Not In Committee,Not In Committee,3,2294,87,Legislator,General Public,Legislator,Thank you.,In opposition.,"Now my joint author, Assemblymember Bonta, will discuss the specifics of the regulatory structure in AB 34.",755747,755387,[755745],800
FALSE,FALSE,FALSE,TRUE,FALSE,FALSE,[37925],Member,Not In Committee,Not In Committee,82,3037,3037,Legislator,State Agency Rep,State Agency Rep,"I mean there was a reason why it was called the hidden tax. But, so, would you agree to, quick question, many have also expected that the price will go up to like seventy five cents per gallon. Is that high?",We never accepted that number and to this day we don't see any basis for that speculation.,Throughout these initiatives I think we can show that we can achieve the the state's ambitious air quality and climate objectives while continuing to grow our economy. I look forward to working with a committee and all of these endeavors. Thank you.,37931,37833,[37925],45
FALSE,TRUE,FALSE,FALSE,FALSE,FALSE,[1176828],Member,Not In Committee,Not In Committee,59,5498,3396,Legislator,General Public,State Agency Rep,"Thank you, next speaker.","Leticia Garcia with Riverside County School, just want to align my comments with my colleague from San Diego Unified, and also add that we're appreciative for the flexibility of using those dollars to address some drought related issues locally. Thank you.",Meaning what that gap closure will be.,1176830,1176678,[1176828],1144
FALSE,TRUE,FALSE,FALSE,FALSE,FALSE,[1176828],Member,Not In Committee,Not In Committee,59,5498,3396,Legislator,General Public,State Agency Rep,"Thank you, next speaker.","Leticia Garcia with Riverside County School, just want to align my comments with my colleague from San Diego Unified, and also add that we're appreciative for the flexibility of using those dollars to address some drought related issues locally. Thank you.",Meaning what that gap closure will be.,1176830,1176678,[1176828],1144
FALSE,TRUE,FALSE,FALSE,FALSE,FALSE,"[15942883, 15970181]",Not In Committee,Not In Committee,Chair,62,15688,53,Legislator,General Public,Legislator,"Thank you, Madam Chair, good morning again members. SB 329 requires all state and local programs designed to facilitate home ownership to include manufactured homes. Even though many low-income families in California live in mobile home parks, they are not considered affordable housing and are excluded from resources, such as loan assistance and replacement with new, energy-efficient manufactured homes., Thank you very much, I respectfully ask for an aye vote.","Benjamin Palmer on behalf of the California Manufactured Housing Institute in strong support, here to answer any questions.","That'll work, next we have SB 329, this enjoys a do pass recommendation.",15942887,15942882,"[15942883, 15970181]",30504
FALSE,TRUE,FALSE,FALSE,TRUE,FALSE,[2202498],Possible Chair,Not In Committee,Not In Committee,92,13999,13975,Legislator,General Public,General Public,"Thank you. Why don't we go to Anne, because you have to leave pretty soon. Right, Anne? So, why don't we go to Anne Mayer, she's the Executive Director down at Riverside, and you also have the background of not only working at the Riverside Transportation Commission, but working in our state government Caltrans, correct?",I do.,"And then finally I would hope that the state continues to evaluate other promising options for raising revenues, whether that's higher truck weight fees or moving some of the truck weight fee revenue into dedicated pot of money for transportation. So with that, I thank you very much for your attention and before I run off, are there any questions?",2202502,2287700,[2202498],2081
FALSE,TRUE,FALSE,FALSE,FALSE,FALSE,[3566590],Member,Not In Committee,Not In Committee,31,14856,14856,Legislator,General Public,General Public,The clerk will read.,"Assembly Bill 706, by Assemblymember Bonilla, an act relating to the California AmeriCorps STEM.","Assembly Bill 587, by Assemblymember Chau, an act relating to mobile homes.",3566592,3566502,[3566590],4835
FALSE,TRUE,FALSE,FALSE,FALSE,FALSE,[2038247],Member,Not In Committee,Not In Committee,64,344,13642,Legislator,General Public,General Public,Thank you Kevin.,"Thank you Madame Chair, Frank Mecco, CWCA, the sponsors of the request to the Committee and to your staff, I just want to thank you for hearing it. Mr. Stone in response to that question you asked and please correct me if I if I don't have this right, but the information that we have is that the funding in the current budget allows for five trainings for thirty people per region.","Thank you, Kevin working for the California Rights Organization. Ditto.",2038249,2038245,[2038247],1929
FALSE,TRUE,FALSE,FALSE,FALSE,FALSE,[633377],Not In Committee,Not In Committee,Not In Committee,3,5973,5973,Legislator,Unlabeled,Unlabeled,"Well no, yes, you may now respond.","So as a company that engaged in this practice, there's a couple of interesting points.",So may I?,633379,633375,[633377],671
FALSE,TRUE,FALSE,FALSE,FALSE,FALSE,[12429946],Member,Not In Committee,Chair,36368,12640,99,Legislator,General Public,Legislator,"Yeah, okay.","Eddie Moreno, on behalf of Sierra Club California, in support.","which is not really accessible. When I was at PPIC, it was impossible to get all the healthcare data. So, if machine readable code just as a standard keep adding it in.",12432009,12432008,[12429946],26928
FALSE,TRUE,FALSE,FALSE,FALSE,FALSE,[12429946],Member,Not In Committee,Chair,36368,12640,99,Legislator,General Public,Legislator,"Yeah, okay.","Eddie Moreno, on behalf of Sierra Club California, in support.","which is not really accessible. When I was at PPIC, it was impossible to get all the healthcare data. So, if machine readable code just as a standard keep adding it in.",12432009,12432008,[12429946],26928
FALSE,TRUE,FALSE,FALSE,FALSE,FALSE,[14759762],Member,Not In Committee,Not In Committee,66,6440,6440,Legislator,General Public,General Public,Thank you. Remove File Item 191 AB 981 Gray from the consent calendar at the request of the author.,"Thank you, Senator Hill. The desk will note.","Senator Hill, for which purpose do you rise?",14759763,14715077,[14759762],30140
TRUE,FALSE,FALSE,FALSE,FALSE,FALSE,[451129],Not In Committee,Not In Committee,Not In Committee,84,719,4682,Legislator,Lobbyist,General Public,"[Brian] Mr. Caldwell, just real quick for a second, I just don't, this is informational. So, I really don't wanna get into discussing current legislation that perhaps is pending.","- [Mr. Caldwell] But, the argument that's being made by other people is that this is just a little guy. It's just a, ya know, there's a, language like, ""innovation is making it possible ""for ordinary people to earn additional income ""through apartment sha","So, what we find is, that the best way to achieve, I think, what we're all hoping for, a high rate of compliance and a high rate of people paying their hotel occupancy tax or transient occupancy tax is to look at those best practices, look at those different model examples and I think what they'll show you is the lower rates of barriers to people getting involved achieve the higher rate of compliance. Thank you very much.",451135,450949,[451129],493
TRUE,FALSE,FALSE,FALSE,TRUE,FALSE,"[7594378, 7608964]",Member,Not In Committee,Member,10481,6440,60,Legislator,General Public,Legislator,"So what I'm having trouble with is the assertion that this is a big disaster, this legislation. That this is going to, according to the Sonoma County Sheriff's Office letter, eliminate a successful and proactive investigative tool., Eliminate. When, as it relates to juveniles at least, you've indicated that there's been, seems like, very little effect.","Well, the truth is that the juvenile justice system attempts to rehabilitate. There's no rehabilitation in the adult system.",Senator Glazer?,7594380,7594324,"[7594378, 7608964]",7471
FALSE,TRUE,FALSE,FALSE,FALSE,FALSE,[1173958],Member,Not In Committee,Not In Committee,59,3751,3060,Legislator,State Agency Rep,LAO,"Please show this passing 3-0. Moving on now to item number three, which deals with CalWorks, adjusted CalWorks Childcare Case Load Funding. Department of Finance.","Stage two and stage three of CalWorks Childcare is funded as an entitlement. Stage three is not legally an entitlement, but we do fund it that way, and so every governor's budget and May revision, we do update the estimates for case load and cost of providing care in these programs.","To round out a whole classroom, so that they could have a transitional kindergarten-focused curriculum, rather than a combo transitional kindergarten-kindergarten curriculum in the classroom.",1173964,1173682,[1173958],1140
TRUE,FALSE,FALSE,FALSE,TRUE,FALSE,[4379471],Possible Chair,Not In Committee,Possible Chair,34,16517,66,Legislator,General Public,Legislator,"So, because I know it was mentioned earlier in testimony over 7,000 folks have been revoked. I mean, that seems to be the post effective tool, as opposed to Various ordinances. I mean, it's really the tool of revoking and shutting them down.","Right, before you would have to go through a very arduous right abatement process or multiple violations, and it was frustrating. Very frustrating for locals who, we're getting complaints. And people are asking why? Why are they still in business when you know what's going on there.",Thank you. Chair Salas?,4379473,4379423,[4379471],5696
FALSE,TRUE,FALSE,FALSE,FALSE,FALSE,[10632586],Possible Chair,Not In Committee,Possible Chair,72,102367,103,Legislator,General Public,Legislator,"They will go ahead, we'll go ahead and through the panel and so okay, thanks.","Good afternoon, I'm Erica Murray. I'm the President and CEO of the California Association of Public Hospitals and Health Systems. I really appreciate that opportunity to speak before you. And I especially appreciate the staff's work in putting this together so we can all learn about this really important issue, so thank you. I have never used a PowerPoint in this room, so and I am not terribly technologically savvy, okay.","I've seen none, I'll go ahead and turn over to Dr. Wood, and we'll go on to the next section.",10632587,10632559,[10632586],23817
FALSE,TRUE,FALSE,FALSE,FALSE,FALSE,[7206907],Member,Not In Committee,Chair,40,16689,12,Legislator,General Public,Legislator,Thank you Mr. Chairman.,"Two quick questions maybe for the representative from LA Ricks. The first is these networks don't ever tend to be finished. You're all As the growth of data, the growth of communications traffic in situations like this over time,","To the Committee, or Subcommittee, Mr. Hadley?",7206909,7214340,[7206907],7303
FALSE,TRUE,FALSE,FALSE,FALSE,FALSE,[7206907],Member,Not In Committee,Chair,40,16689,12,Legislator,General Public,Legislator,Thank you Mr. Chairman.,"Two quick questions maybe for the representative from LA Ricks. The first is these networks don't ever tend to be finished. You're all As the growth of data, the growth of communications traffic in situations like this over time,","To the Committee, or Subcommittee, Mr. Hadley?",7206909,7214340,[7206907],7303
FALSE,TRUE,FALSE,FALSE,FALSE,FALSE,[325340],Member,Not In Committee,Not In Committee,64,4053,3955,Legislator,General Public,General Public,Thank you Don. Thank you.,"Hi. Thank you for spending a long day with all of us. Like the previous speaker, I also cannot stand talking in front of people, so bear with me. My name is Mary Brett. I'm the Executive Director of a small not for profit agency in in the East Bay. We provide services, we provide ILS and supported living services.","In my organization, which is much smaller than some people that are sitting in the front-row, it's going to be of $49,200 increase when it goes to ten dollars an hour, just for my twelve exempt staff. So, then that puts me at $150,000 deficit. I really hope that people will consider those things. Thank you.",325342,324796,[325340],359
FALSE,TRUE,FALSE,FALSE,FALSE,FALSE,"[12375237, 12375240]",Member,Not In Committee,Member,31,14856,31,Legislator,General Public,Legislator,"Thank you, Mr. Dababneh. Seeing no discussion or debate on the resolution, and without objection, we may take a voice vote. All those in favor say aye. Aye. Oppose say, nay. The ayes have it, the resolution is adopted., File item 52 is ACR56. Clerk will read.",Assembly Concurrent Resolution 56 by Assembly Member Reyes relative to sexual assault.,"Thank you Mr. Daly. Seeing no discussion or debate on the item, clerk will open the roll. All members vote who desire to vote. All members vote who desire to vote. All members vote who desire to vote.",12375241,12375221,"[12375237, 12375240]",26882
FALSE,TRUE,FALSE,FALSE,FALSE,FALSE,[1639443],Vice-Chair,Not In Committee,Chair,57,6440,98,Legislator,General Public,Legislator,I'd like to move the bill.,Thank you.,Senator Anderson.,1639445,1639441,[1639443],1555
FALSE,TRUE,FALSE,FALSE,FALSE,FALSE,[1639443],Vice-Chair,Not In Committee,Chair,57,6440,98,Legislator,General Public,Legislator,I'd like to move the bill.,Thank you.,Senator Anderson.,1639445,1639441,[1639443],1555
FALSE,TRUE,FALSE,FALSE,FALSE,FALSE,[6148995],Member,Not In Committee,Member,31,15792,91,Legislator,Staff,Bill Author,"Thank you, Mr.Thurmond. Seeing no discussion or debate on the item, clerk will open the roll. All members vote who desire to vote. All members vote who desire to vote. All members vote who desire to vote. Clerk will close the roll, tally the vote. Aye 74, no 0. Measure passes. File item 136 AB 2492 for the purpose of amendment.",Assembly Bill 2492 with amendments by Assemblymember Alejo.,"In fact, many of the participants in this cemetery actually do do that. They take a long term lay away plan.",6149005,6148905,[6148995],6922
TRUE,FALSE,FALSE,FALSE,TRUE,FALSE,[1864315],Member,Not In Committee,Not In Committee,3,3036,3036,Legislator,LAO,LAO,"I think it's a little bit different when it's a mixed drink. And the other thing I would think would be really helpful information is a comparison of what our taxes are for alcohol, compared to other states. As I understand it, we're traditionally very, very low, compared to the 50 states.","It's very difficult to compare excise taxes for alcohol from one state to the other, state's tax them in different ways. But in general, the data I've seen indicates that California is in the lower half of states, and it varies by beverage. We have a very low wine tax rate. California's obviously a major wine producer.","I believe at the state level that would be a separate tax to be considered. On the excise tax, this is how the state taxes these beverages per gallon. But I'll look into that and provide your staff with additional information if needed.",1864323,1864309,[1864315],1768
FALSE,TRUE,FALSE,FALSE,FALSE,FALSE,"[5551311, 5551313, 5551315, 5551319]",Member,Not In Committee,Member,59,3980,59,Legislator,State Agency Rep,Legislator,"That's what I'm wondering., He's absolutely correct, there was no reason to me to come up. Okay, thank you. Thanks, appreciate that. With that, if there's no other questions, I want to thank and excuse those members, of this panel who aren't on the next panel, which is all of you, so thank you all., And we will begin with Mr. Baier.","Thank you, Mr. Chair and members. My name is John Baier with the State's Auditor's Office, and actually my colleague, Kathleen Fullerton, will do our presenting for us. Okay.","Senator Allen, questions?",5551321,5551291,"[5551311, 5551313, 5551315, 5551319]",6703
TRUE,FALSE,FALSE,FALSE,FALSE,FALSE,[105620],Possible Chair,Not In Committee,Not In Committee,92,3195,3195,Legislator,State Agency Rep,State Agency Rep,We just had to count them.,"It was more than a count. It was sort of, how do you garner resources and work those resources together to get the people who need that assistance the most rapidly? So the rapid re-housing model, which is getting people into a stable environment as quickly as possible is a really big deal. And that is a matter of the state providing technical assistance and other resources in order for the local jurisdictions to coordinate their efforts accordingly.","Right. Previously, I was heading me California Housing Finance Agency, so I moved over.",105622,105574,[105620],103
TRUE,FALSE,FALSE,FALSE,TRUE,FALSE,"[7549379, 7549381, 7549383, 7549387, 7549389, 7551982, 7551983]",Member,Not In Committee,Chair,64,21151,102,Legislator,General Public,Legislator,"Which is your fundamental right., I would say as we continue to talk about the correlation and relationships, it's the kind of conversations, as a sitting member of the Legislature, that I personally take offense to., In the Western Growers letter, the notion that Mr. Ross' connections with the UFW are long-standing and well known, as is his influence in the Legislature., Well, as we all are well aware, any number of special interests have a role to play to represent their special interests before the Legislature., And I find it very ironic that a letter written on the Western Growers letterhead suggests that, while we certainly know that the Western Growers have played a very strong, active role in supporting candidates, sitting members, opposing candidates, contributed dollars to independent expenditure committees., So it feels a little like throwing rocks at glass houses, to suggest that one consultant outweighs the amazing power that the Western Growers have over the political process in this Legislature., I think finally I would just say this whole notion of an expectation of a balance in your rulings is curious to me. Because as I read the role and responsibility of the ALRB, it's adjudicating according to the law.","Yes, ma'am.","Thank you, Mr. Vice Chair. Miss Mitchell?",7549393,7551901,"[7549379, 7549381, 7549383, 7549387, 7549389, 7551982, 7551983]",7431
